{
  "dslVersion": "1.0",
  "dataset": {
    "code": "ads_finance_daily_net_sales",
    "name": "财务日净销售交付",
    "description": "仅为已发布财务消费合同生成的交付数据集",
    "type": "SINGLE_SOURCE",
    "layer": "ADS",
    "semanticContractVersion": "1.0",
    "consumerContractId": "50000000-0000-4000-8000-000000000001"
  },
  "nodes": [{"id": "daily_sales", "type": "DATASET", "datasetVersionId": "40000000-0000-4000-8000-000000000001", "alias": "sales", "projection": ["stat_date", "net_sales"], "sourceFilters": []}],
  "joins": [],
  "fields": [
    {"id": "field_stat_date", "code": "stat_date", "name": "统计日期", "role": "TIME", "expression": {"type": "FIELD_REF", "nodeId": "daily_sales", "field": "stat_date"}, "canonicalType": "DATE", "nullable": false},
    {"id": "field_net_sales", "code": "net_sales", "name": "净销售额", "role": "MEASURE", "expression": {"type": "FIELD_REF", "nodeId": "daily_sales", "field": "net_sales"}, "canonicalType": "DECIMAL", "unit": "CNY", "nullable": false}
  ],
  "filters": [],
  "groupBy": [],
  "having": [],
  "sorts": [{"fieldId": "field_stat_date", "direction": "ASC"}],
  "parameters": [],
  "outputGrain": {"description": "每行一个财务自然日", "keyFields": ["stat_date"], "timeField": "stat_date", "defaultTimeGrain": "DAY"},
  "executionPolicy": {"mode": "MATERIALIZED_PREFERRED", "timeoutMs": 5000, "previewLimit": 100, "resultLimit": 10000, "cacheTtlSeconds": 300, "materialization": {"enabled": true, "refreshMode": "MANUAL"}}
}
